{
  "schemaVersion": "GitIt Analysis Result v1",
  "project": {
    "root": "Z:\\zzzxp\\Z_zxp\\Gitit\\demo",
    "analyzedAt": "2026-08-13T08:06:20.2521861+00:00",
    "engineVersion": "0.0.4"
  },
  "documentFamilies": [
    {
      "id": "family-1",
      "kind": "Docx",
      "versionIds": [
        "Z:\\zzzxp\\Z_zxp\\Gitit\\demo\\backup\\report.docx",
        "Z:\\zzzxp\\Z_zxp\\Gitit\\demo\\branches\\\u4E13\u5BB6\u4FEE\u6539\u7A3F.docx",
        "Z:\\zzzxp\\Z_zxp\\Gitit\\demo\\branches\\\u6700\u7EC8\u6700\u7EC8\u7248.docx",
        "Z:\\zzzxp\\Z_zxp\\Gitit\\demo\\main\\abc123.docx",
        "Z:\\zzzxp\\Z_zxp\\Gitit\\demo\\main\\artifact_08.docx",
        "Z:\\zzzxp\\Z_zxp\\Gitit\\demo\\main\\artifact_09.docx",
        "Z:\\zzzxp\\Z_zxp\\Gitit\\demo\\main\\artifact_10.docx",
        "Z:\\zzzxp\\Z_zxp\\Gitit\\demo\\main\\artifact_11.docx",
        "Z:\\zzzxp\\Z_zxp\\Gitit\\demo\\main\\artifact_12.docx",
        "Z:\\zzzxp\\Z_zxp\\Gitit\\demo\\main\\artifact_13.docx",
        "Z:\\zzzxp\\Z_zxp\\Gitit\\demo\\main\\artifact_14.docx",
        "Z:\\zzzxp\\Z_zxp\\Gitit\\demo\\main\\artifact_15.docx",
        "Z:\\zzzxp\\Z_zxp\\Gitit\\demo\\main\\artifact_16.docx",
        "Z:\\zzzxp\\Z_zxp\\Gitit\\demo\\main\\artifact_17.docx",
        "Z:\\zzzxp\\Z_zxp\\Gitit\\demo\\main\\artifact_18.docx",
        "Z:\\zzzxp\\Z_zxp\\Gitit\\demo\\main\\artifact_19.docx",
        "Z:\\zzzxp\\Z_zxp\\Gitit\\demo\\main\\artifact_20.docx",
        "Z:\\zzzxp\\Z_zxp\\Gitit\\demo\\main\\\u4E13\u5BB6\u4FEE\u6539\u7A3F.docx",
        "Z:\\zzzxp\\Z_zxp\\Gitit\\demo\\main\\\u62A5\u544A.docx",
        "Z:\\zzzxp\\Z_zxp\\Gitit\\demo\\main\\\u62A5\u544A\u4FEE\u6539.docx",
        "Z:\\zzzxp\\Z_zxp\\Gitit\\demo\\main\\\u6700\u7EC8.docx",
        "Z:\\zzzxp\\Z_zxp\\Gitit\\demo\\main\\\u6700\u7EC82.docx",
        "Z:\\zzzxp\\Z_zxp\\Gitit\\demo\\main\\\u6700\u7EC8\u6700\u7EC8\u7248.docx",
        "Z:\\zzzxp\\Z_zxp\\Gitit\\demo\\wechat\\report.docx"
      ],
      "detectionBasis": "lineage/duplicate/content-evidence"
    },
    {
      "id": "family-2",
      "kind": "Docx",
      "versionIds": [
        "Z:\\zzzxp\\Z_zxp\\Gitit\\demo\\large-rewrite\\executive-rewrite.docx"
      ],
      "detectionBasis": "no corroborated relation"
    },
    {
      "id": "family-3",
      "kind": "Docx",
      "versionIds": [
        "Z:\\zzzxp\\Z_zxp\\Gitit\\demo\\reconstructed\\copy-paste-rebuild.docx"
      ],
      "detectionBasis": "no corroborated relation"
    },
    {
      "id": "family-4",
      "kind": "Pptx",
      "versionIds": [
        "Z:\\zzzxp\\Z_zxp\\Gitit\\demo\\slides\\deck-v1.pptx"
      ],
      "detectionBasis": "no corroborated relation"
    },
    {
      "id": "family-5",
      "kind": "Pptx",
      "versionIds": [
        "Z:\\zzzxp\\Z_zxp\\Gitit\\demo\\slides\\deck-v2.pptx"
      ],
      "detectionBasis": "no corroborated relation"
    },
    {
      "id": "family-6",
      "kind": "Xlsx",
      "versionIds": [
        "Z:\\zzzxp\\Z_zxp\\Gitit\\demo\\spreadsheets\\data-v1.xlsx"
      ],
      "detectionBasis": "no corroborated relation"
    },
    {
      "id": "family-7",
      "kind": "Xlsx",
      "versionIds": [
        "Z:\\zzzxp\\Z_zxp\\Gitit\\demo\\spreadsheets\\data-v2.xlsx"
      ],
      "detectionBasis": "no corroborated relation"
    },
    {
      "id": "family-8",
      "kind": "Docx",
      "versionIds": [
        "Z:\\zzzxp\\Z_zxp\\Gitit\\demo\\unrelated\\abc123.docx"
      ],
      "detectionBasis": "no corroborated relation"
    }
  ],
  "versions": [
    {
      "id": "Z:\\zzzxp\\Z_zxp\\Gitit\\demo\\backup\\report.docx",
      "path": "Z:\\zzzxp\\Z_zxp\\Gitit\\demo\\backup\\report.docx",
      "kind": "Docx",
      "duplicateOf": null,
      "fileHash": "F16A54F92327067E3FB901DBB3B166896DB84D4A7052918FC89CBCC3D3BC7B7F",
      "fingerprint": {
        "paragraphs": "8",
        "tables": "1",
        "bodyHash": "8A440DE7DF9A04E7",
        "styleHash": "12BD493D47080E19",
        "rsidCount": "5",
        "trackedRevisionCount": "1"
      }
    },
    {
      "id": "Z:\\zzzxp\\Z_zxp\\Gitit\\demo\\branches\\\u4E13\u5BB6\u4FEE\u6539\u7A3F.docx",
      "path": "Z:\\zzzxp\\Z_zxp\\Gitit\\demo\\branches\\\u4E13\u5BB6\u4FEE\u6539\u7A3F.docx",
      "kind": "Docx",
      "duplicateOf": null,
      "fileHash": "2A2A3FEA57491AEC22DC1510141E8BFC62F716E00B5D5331B96A898247D1C5AE",
      "fingerprint": {
        "paragraphs": "13",
        "tables": "1",
        "bodyHash": "2D4208F2AB7F9521",
        "styleHash": "A4BE1B38031503FD",
        "rsidCount": "9",
        "trackedRevisionCount": "1"
      }
    },
    {
      "id": "Z:\\zzzxp\\Z_zxp\\Gitit\\demo\\branches\\\u6700\u7EC8\u6700\u7EC8\u7248.docx",
      "path": "Z:\\zzzxp\\Z_zxp\\Gitit\\demo\\branches\\\u6700\u7EC8\u6700\u7EC8\u7248.docx",
      "kind": "Docx",
      "duplicateOf": null,
      "fileHash": "081FD06D0809F1C2FEA6CBD9D58664B7C8EEAE885B896342171B8EFD085272FB",
      "fingerprint": {
        "paragraphs": "13",
        "tables": "1",
        "bodyHash": "4B15B45F1EA7160E",
        "styleHash": "A4BE1B38031503FD",
        "rsidCount": "9",
        "trackedRevisionCount": "1"
      }
    },
    {
      "id": "Z:\\zzzxp\\Z_zxp\\Gitit\\demo\\large-rewrite\\executive-rewrite.docx",
      "path": "Z:\\zzzxp\\Z_zxp\\Gitit\\demo\\large-rewrite\\executive-rewrite.docx",
      "kind": "Docx",
      "duplicateOf": null,
      "fileHash": "286BA693E58B41B58A58F9EED876995D453EBA101D34145121D3A72A190034B4",
      "fingerprint": {
        "paragraphs": "63",
        "tables": "1",
        "bodyHash": "45893E0A13E22199",
        "styleHash": "E44628E0F24B2B8B",
        "rsidCount": "21",
        "trackedRevisionCount": "1"
      }
    },
    {
      "id": "Z:\\zzzxp\\Z_zxp\\Gitit\\demo\\main\\abc123.docx",
      "path": "Z:\\zzzxp\\Z_zxp\\Gitit\\demo\\main\\abc123.docx",
      "kind": "Docx",
      "duplicateOf": null,
      "fileHash": "7B3E0090B58EA6CB4002988F97BD1C740FDC716D0F125B2F7B27CF7F7840723A",
      "fingerprint": {
        "paragraphs": "10",
        "tables": "1",
        "bodyHash": "A2460A8E6931CF49",
        "styleHash": "EC8B18346527A1D1",
        "rsidCount": "7",
        "trackedRevisionCount": "1"
      }
    },
    {
      "id": "Z:\\zzzxp\\Z_zxp\\Gitit\\demo\\main\\artifact_08.docx",
      "path": "Z:\\zzzxp\\Z_zxp\\Gitit\\demo\\main\\artifact_08.docx",
      "kind": "Docx",
      "duplicateOf": null,
      "fileHash": "1C2440427A85CF220F8F96D9C5A39AA3E9C8B3D7F88B8EAC45DFE5D790CE98D6",
      "fingerprint": {
        "paragraphs": "11",
        "tables": "1",
        "bodyHash": "8D77A11FE0A1AF6F",
        "styleHash": "A23B5103F33B390D",
        "rsidCount": "8",
        "trackedRevisionCount": "1"
      }
    },
    {
      "id": "Z:\\zzzxp\\Z_zxp\\Gitit\\demo\\main\\artifact_09.docx",
      "path": "Z:\\zzzxp\\Z_zxp\\Gitit\\demo\\main\\artifact_09.docx",
      "kind": "Docx",
      "duplicateOf": null,
      "fileHash": "B0403FEF928D4C9F45820714784450C9279CED63A2BA1B6B176553F7B055D027",
      "fingerprint": {
        "paragraphs": "12",
        "tables": "1",
        "bodyHash": "3F599D35053ADBB5",
        "styleHash": "480880424288D536",
        "rsidCount": "9",
        "trackedRevisionCount": "1"
      }
    },
    {
      "id": "Z:\\zzzxp\\Z_zxp\\Gitit\\demo\\main\\artifact_10.docx",
      "path": "Z:\\zzzxp\\Z_zxp\\Gitit\\demo\\main\\artifact_10.docx",
      "kind": "Docx",
      "duplicateOf": null,
      "fileHash": "458A8D7F67079F66BFAAFA1FBC67D7892F45FFE8A2B01868A91518C457FB625B",
      "fingerprint": {
        "paragraphs": "13",
        "tables": "1",
        "bodyHash": "EFD15A4F9D064E88",
        "styleHash": "A4BE1B38031503FD",
        "rsidCount": "10",
        "trackedRevisionCount": "1"
      }
    },
    {
      "id": "Z:\\zzzxp\\Z_zxp\\Gitit\\demo\\main\\artifact_11.docx",
      "path": "Z:\\zzzxp\\Z_zxp\\Gitit\\demo\\main\\artifact_11.docx",
      "kind": "Docx",
      "duplicateOf": null,
      "fileHash": "215CE7CE925D32EDF5DC6EBF4FCC92F9089BE34A594A494D59AC25B21F8FDDAF",
      "fingerprint": {
        "paragraphs": "14",
        "tables": "1",
        "bodyHash": "3ADFDEB5FB8688EB",
        "styleHash": "68C99F8214D8CE21",
        "rsidCount": "11",
        "trackedRevisionCount": "1"
      }
    },
    {
      "id": "Z:\\zzzxp\\Z_zxp\\Gitit\\demo\\main\\artifact_12.docx",
      "path": "Z:\\zzzxp\\Z_zxp\\Gitit\\demo\\main\\artifact_12.docx",
      "kind": "Docx",
      "duplicateOf": null,
      "fileHash": "F98EAF8DF3141E41019A5C5D369BF78D338DA4360D99027AEB4CF77C19240E10",
      "fingerprint": {
        "paragraphs": "15",
        "tables": "1",
        "bodyHash": "2B17BACCD660CCF8",
        "styleHash": "9DCF61567A2F15F8",
        "rsidCount": "12",
        "trackedRevisionCount": "1"
      }
    },
    {
      "id": "Z:\\zzzxp\\Z_zxp\\Gitit\\demo\\main\\artifact_13.docx",
      "path": "Z:\\zzzxp\\Z_zxp\\Gitit\\demo\\main\\artifact_13.docx",
      "kind": "Docx",
      "duplicateOf": null,
      "fileHash": "EE8D5CBE0D2BB865238FEA99EFD992C6308BEDCA2332A4DE1D0C12B61B9A86D0",
      "fingerprint": {
        "paragraphs": "16",
        "tables": "1",
        "bodyHash": "199E6C2AC097CE8E",
        "styleHash": "86FCF6A50AAF62F1",
        "rsidCount": "13",
        "trackedRevisionCount": "0"
      }
    },
    {
      "id": "Z:\\zzzxp\\Z_zxp\\Gitit\\demo\\main\\artifact_14.docx",
      "path": "Z:\\zzzxp\\Z_zxp\\Gitit\\demo\\main\\artifact_14.docx",
      "kind": "Docx",
      "duplicateOf": null,
      "fileHash": "C263029EBB4BD5B81B5DF7EEA20D9CB7F98326CDF4393B4BC4471A725C6B1CF9",
      "fingerprint": {
        "paragraphs": "17",
        "tables": "1",
        "bodyHash": "DE6386539C82ED28",
        "styleHash": "06491E6F04FE3930",
        "rsidCount": "14",
        "trackedRevisionCount": "1"
      }
    },
    {
      "id": "Z:\\zzzxp\\Z_zxp\\Gitit\\demo\\main\\artifact_15.docx",
      "path": "Z:\\zzzxp\\Z_zxp\\Gitit\\demo\\main\\artifact_15.docx",
      "kind": "Docx",
      "duplicateOf": null,